{
  "event_id": "use_11111111111111111111111111111111",
  "call_id": "call_22222222222222222222222222222222",
  "schema_version": 1,
  "request_id": null,
  "session_id": "sess_5f6e7d8c9b0a1e2d3c4b5a69",
  "subject_type": "demo",
  "subject_id": "demo_cap_33445566778899001122",
  "user_id": null,
  "provider": "deepseek",
  "model": "deepseek-v4-flash",
  "provider_request_id": "0d1e2f3a-4b5c-6d7e-8f90-a1b2c3d4e5f6",
  "occurred_at": "2026-09-12T12:05:33.770Z",
  "enqueued_at": "2026-09-12T12:05:34.210Z",
  "cache_hit_input_tokens": 64,
  "cache_miss_input_tokens": 1024,
  "output_tokens": 256,
  "reasoning_tokens": 0,
  "total_tokens": 1344,
  "raw_usage": {
    "finish_reason": "stop",
    "prompt_tokens": 1088,
    "completion_tokens": 256,
    "prompt_cache_hit_tokens": 64,
    "prompt_cache_miss_tokens": 1024,
    "provider_meta_v1": {
      "meta_version": 1,
      "service": "deepseek",
      "usage_shape": "chat-completions",
      "channel": "demo"
    }
  }
}
