{
  "event_id": "use_deadbeefdeadbeefdeadbeefdeadbeef",
  "call_id": "call_feedfacefeedfacefeedfacefeedface",
  "schema_version": 1,
  "request_id": "req_cafebabe0123456789abcdef",
  "session_id": "sess_0a1b2c3d4e5f60718293a4b5",
  "subject_type": "user",
  "subject_id": "usr_1234abcd5678ef901234abcd",
  "user_id": "usr_1234abcd5678ef901234abcd",
  "provider": "deepseek",
  "model": "deepseek-v4-flash-vision-exp",
  "provider_request_id": "5b6e7f80-9a1b-4c3d-8e2f-0a9b8c7d6e5f",
  "occurred_at": "2026-09-07T07:20:55.001Z",
  "enqueued_at": "2026-09-07T07:20:55.640Z",
  "cache_hit_input_tokens": 742,
  "cache_miss_input_tokens": 31808,
  "output_tokens": 640,
  "reasoning_tokens": 0,
  "total_tokens": 33190,
  "raw_usage": {
    "finish_reason": "stop",
    "prompt_tokens": 32550,
    "completion_tokens": 640,
    "prompt_cache_hit_tokens": 742,
    "prompt_cache_miss_tokens": 31808,
    "vision_image_tokens": 28672,
    "provider_meta_v1": {
      "meta_version": 1,
      "service": "deepseek",
      "usage_shape": "chat-completions",
      "input_mode": "image+text"
    }
  }
}
